剧本ID,剧本文件名,剧目名称,剧目别名,全本出处,是否折子戏,时代背景,故事地点,主题关键词,主题分类,选材来源,具体来源,剧本形态,主要行当,角色-行当映射,主角,主要唱腔声腔,主要板式,唱法备注,剧情简介,备注
hanju_0231,窦老送子.pdf,窦老送子,,白兔记（又称刘知远白兔记）,是,五代,潼台关,忘本；教训；夫妻团聚,权斗；孝义,古典文学；戏曲传统,元“四大南戏”之一的《白兔记》；《六十种曲本》第二十二出《窦公送子》,整理本,七小；四旦；五丑；十杂,刘知远（七小）；夫人（四旦）；窦老（五丑）；中军（十杂）,刘知远；窦老,二黄；西皮,二流；摇板；倒板,引；诗；念；叫头,刘知远发迹后镇守潼台关，家乡窦老汉送其子咬脐郎前来。刘知远在窦老面前夸耀官职并告以另娶，窦老气愤，历数刘知远当年落魄、李三娘受苦及救子等事，将其教训一番。刘知远悔悟，决定接李三娘到任所共享安乐。,文件夹: 秦汉 | 页数: 9
hanju_0232,紫家庄.pdf,紫家庄,落庄,,是,东汉,紫家庄,结亲；退兵；复仇,权斗；情爱,历史演义,汉剧《两汉故事》系列,整理本,七小；八贴；三生,刘庄（七小）；紫金莲（八贴）；朱元龙（三生）,刘庄；紫金莲,二黄；西皮,二流；小导板,引；诗；念；叫头,东汉光武帝死后，皇叔刘唐通敌，皇姑天仙公主保护太子刘庄外逃，在二龙山失散。刘庄逃至紫家庄，紫金莲因父被光武帝杀害，欲杀刘庄报仇。丫鬟从中周旋，使二人结为夫妻。朱元龙率兵围困紫家庄，紫金莲用父亲遗像吓退敌军。,文件夹: 秦汉 | 页数: 11
hanju_0233,芦林会.pdf,芦林会,,跃鲤记,是,汉代,芦林,孝道；夫妻离别；冤屈,孝义；权斗,古典文学；戏曲传统,传奇《跃鲤记》的“芦林辩非”一折；汉剧传统本，流传本为余春衡、邓云凤、夏中侠演出本,整理本,一末；四旦,姜诗（一末）；庞氏（四旦）,姜诗；庞氏,二黄；平板,三眼平板；平板；二黄摇板,念；叫头；炮头,姜诗之妻庞三春因婆婆听信谗言被逐出家门。一日，庞三春在芦林拾柴时偶遇姜诗，二人争论被逐缘由。庞三春辩白自己并无不孝，姜诗虽念及夫妻情义，却因不敢违抗母命，最终含泪而别。,文件夹: 秦汉 | 页数: 11
hanju_0234,苏武牧羊.pdf,苏武牧羊,,,是,汉代,北海,忠义；牧羊；鸿雁寄书,权斗；孝义,历史演义；戏曲传统,汉剧《两汉故事》系列,整理本,一末；七小,苏武（一末）；黄石公（一末）；张良（七小）,苏武,二黄；西皮,慢板；二流；摇板；慢西皮；西皮垛子；西皮一字板；西皮摇板,引；诗；念；叫头,汉武帝年间，中郎将苏武奉旨出使匈奴，被单于扣留并劝降。苏武不从，被流放北海牧羊十九载，受尽艰辛。黄石公与张良赠以金丹，使其不死。后单于感其忠义，命人送苏武持旄节返回汉廷。,文件夹: 秦汉 | 页数: 7
hanju_0235,荥阳城.pdf,荥阳城,,楚汉相争,是,秦末,荥阳,替主解围；慷慨赴死；忠义,权斗；孝义,历史演义,汉剧《楚汉相争》,整理本,三生；十杂,纪信（三生）；刘邦（三生）；项羽（十杂）；张良（三生）,纪信；刘邦；项羽,西皮,原板；导板；一字板；垛子；快板；摇板,引；诗；念,刘邦被项羽围困在荥阳，张良以春秋逢丑父救齐顷公的故事激励纪信。纪信乔装成刘邦去见项羽，真刘邦乘隙逃走。项羽发现受骗后大怒，欲用火焚纪信，纪信慷慨赴死。,文件夹: 秦汉 | 页数: 32
hanju_0236,访韩信.pdf,访韩信,张良访信,,否,秦末,咸阳,访贤；弃暗投明；赠剑,求贤；权斗,历史演义；民间传说,汉剧'两汉故事'系列,整理本,一末；七小,张良（一末）；韩信（七小）,张良；韩信,西皮,慢板；摇板,引；诗；念,韩信胸怀韬略却不被项羽重用，屈居执戟郎，心怀怨恨。张良得知后，身背宝剑前往楚营探访，以卖剑为名劝说韩信弃楚投汉。韩信被说服，决定投奔刘邦，张良赠予元戎宝剑并写下荐书，指点其经小道度陈仓前往汉中。,文件夹: 秦汉 | 页数: 9
hanju_0237,逍遥津.pdf,逍遥津,,,否,东汉末年,许昌,权臣欺君；血诏搬兵；忠奸斗争,权斗；复仇,历史演义,汉剧'两汉故事'系列,整理本,三生；四旦；二旦；七小；一末；十杂；六外；二老生；五丑；贴生,献帝（三生）；伏后（四旦）；曹妃（二旦）；二皇子（七小）；穆顺（三生）；荀攸（一末）；曹操（十杂）；张辽（六外）；夏侯渊（十杂）；司马懿（二老生）；华歆（五丑）；贾诩（贴生）；郗虑（五丑）；王粲（三生）；曹植（七小）；文聘（六外）；伏完（一末）,献帝；曹操；伏后；穆顺,西皮；二黄,摇板；原板；垛子；倒板；二六板,引；诗；念；叫头,汉献帝懦弱，曹操专权。张辽欲扶保曹操登基，邀众臣议事，荀攸不服吐血而亡。早朝时曹操带剑上殿威胁献帝，被众臣劝退。献帝回宫与伏皇后商议，写下血诏命太监穆顺搬请救兵。穆顺出宫时被曹操搜出血诏，遭杀害。曹操随即抄杀伏完满门，入宫杖毙伏后，华歆用药酒毒死二位太子，并逼迫献帝立其女曹妃为正宫。,文件夹: 秦汉 | 页数: 20
hanju_0238,逼休.pdf,逼休,,烂柯山（又称朱买臣休妻）,是,汉代,会稽,嫌贫爱富；逼写休书；雪中赶夫,讽世；孝义,戏曲传统；历史演义,清代盛行之《烂柯山》（又称《朱买臣休妻》）中的一折，全本佚失，在《缀白裘》中载有其中的7折,整理本,六外；八贴,朱买臣（六外）；崔氏（八贴）,朱买臣；崔氏,西皮,慢板；摇板；一字板,引；诗；叫头；念,崔氏因家贫逼丈夫朱买臣写休书改嫁。朱买臣砍柴归来，崔氏嫌其贫穷，吵闹不休，逼其写下休书，并将朱买臣赶出家门。朱买臣无奈离去，崔氏则准备另嫁他人。,文件夹: 秦汉 | 页数: 11
hanju_0239,长生乐.pdf,长生乐,,,否,汉代,金銮殿,祝寿；仙凡；长生,神魔,民间传说,,,三生,刘成（三生）；汉灵帝（三生）,刘成；汉灵帝,二黄,慢二黄,引；诗；念,汉灵帝寿满百年，文武众官庆贺。七十年前的状元刘成，当年荣归祭祖途中被野兽冲散，得麻姑圣母搭救上天，与仙姬婚配，洞中七日世上七十余载。此时刘成奉圣母之命，携长生丹、斩仙帕回朝为灵帝祝寿。灵帝服用长生丹后发白转青、牙落重生，众官拜谢圣母，刘成辞别回山。,文件夹: 秦汉 | 页数: 4
hanju_0240,闹学馆.pdf,闹学馆,马武闹馆,,否,西汉末年,罗郡州,求贤访才；落草为寇；逼人上山,求贤；权斗,历史演义；戏曲传统,汉剧《两汉故事》系列,整理本,十杂；五丑；六外；一末,马武（十杂）；王滕（五丑）；冯彦（六外）；罗卜洞（一末）,马武,西皮,原板；摇板,念；诗,马武在武科场受辱后占据飞龙山，欲杀王莽但苦于无人相助，遂下山访卜人王滕，邀其饮酒并请其上山共谋大事。酒醉后与武士冯彦发生冲突，马武不敌，却爱慕冯彦武艺，请王滕说和，欲邀冯彦上山聚义，被冯彦驱逐。王滕建议马武杀人嫁祸于冯彦门前，迫使冯彦畏罪上山。马武遂杀王滕，将其首级挂在冯彦门前，留诗而去。,文件夹: 秦汉 | 页数: 27
hanju_0241,闹昆阳.pdf,闹昆阳,,,否,西汉末年,白水村；江夏；纪家庄；昆阳,搬兵求救；医疮报恩；打死李霸；纪昌立功,征战；权斗；复仇,历史演义；民间传说,汉剧传统“两汉戏”之一,整理本,一末；二净；三生；四旦；五丑；七小；十杂,刘秀（七小）；姚期（二净）；马武（十杂）；岑彭（七小）；邓禹（三生）；严子陵（一末）；纪魁元（五丑）；纪昌（娃娃生）；刘洪（三生）；李霸（十杂）；李全忠（七小）,刘秀；姚期；纪昌,西皮,导板；慢西皮；快西皮；西皮滚板；西皮快板,引；诗；念；叫头,刘秀在白水村兴兵讨伐王莽，被巨毋霸阻挡。严子陵献计向刘洪搬兵。途中，姚期为纪昌医好恶疮，纪昌感激愿投汉营。刘秀见刘洪，刘洪邀李霸商议，李霸倨傲，姚期不平将其打死。李全忠替父报仇，杀败姚期并穷追不舍，被投军的纪昌一拳打死，割舌报功。姚期随后取全忠首级报功，刘秀命马武验功，纪昌献舌根，姚期惭愧。最终夺取昆阳，众将贺功。,文件夹: 秦汉 | 页数: 22
hanju_0242,鸿门宴.pdf,鸿门宴,,楚汉相争,是,秦末,咸阳；鸿雁川,鸿门宴；楚汉相争；斗智斗勇；放虎归山,权斗；征战,历史演义,汉剧传统剧目《楚汉相争》中的一折,整理本,一末；二净；三生；四旦；五丑；六外；七小；八贴；九夫；十杂,楚怀王（六外）；范增（一末）；刘邦（三生）；项羽（十杂）；章邯（六外）；张良（三生）；樊哙（十杂）；秦子婴（七小）；赵高（二净）；赵朗（五丑）；司马欣（七小）,刘邦；项羽,西皮,导板；慢板；垛子；原板；一字板；散板；流板,引；诗；念,楚怀王与范增定计分两路攻取咸阳，项羽与刘邦拈阄决定路线，并遵约先到咸阳为君。刘邦先入咸阳，项羽后至，自恃强大，不愿遵约，用范增之计设宴鸿门，邀刘邦赴宴欲杀之。刘邦得张良、项伯、樊哙等人救助，最终脱险。,文件夹: 秦汉 | 页数: 51
hanju_0243,黄逼宫.pdf,黄逼宫,,,否,秦代,大郑宫；咸阳,搜宫杀院；嫪毐之乱；母子反目,权斗；复仇,历史演义,汉剧传统戏“三逼宫”之一,整理本,二净；六外；五丑；九夫,秦始皇（二净）；白起（六外）；嫪毐（五丑）；太后（九夫）,秦始皇,西皮,一字板；导板；摇板；快板；原板,引；诗；念；叫头,秦始皇与母后在宫中饮宴，白起听闻嫪毐酒后泄露与太后私通并生有二子，急报始皇。始皇大怒，率校尉搜宫杀院。嫪毐企图以玉玺搬兵对抗，事败被擒。始皇处死嫪毐，摔死二弟，将太后打入渭阳宫，并拟追究吕不韦。,文件夹: 秦汉 | 页数: 10
hanju_0244,龙凤旗.pdf,龙凤旗,,,否,汉代,长安,殿试夺魁；奸臣陷害；赐旗掌权,权斗；求贤,历史演义,西汉演义,整理本,一末；二净；三生；五丑,张文中（一末）；苗从善（二净）；胡金文（三生）；汉宣帝（五丑）；苗福（五丑）,胡金文；张文中；汉宣帝,西皮,摇板；散板；垛子；流板,引；诗；念,汉宣帝时，苗妃被贬后生下太子胡金文，在二龙山抚养。胡金文长大回京赶考错过考期，由老臣张文中引进金殿参加殿试，被点为状元，任职都察院。苗太师原兼都察院，妒忌胡金文，一再陷害。胡金文得张文中帮助，宣帝信任有加，赐龙凤旗、马蹄炮和尚方剑，掌生杀大权，苗太师从此不敢再害他。,文件夹: 秦汉 | 页数: 19
